adoptType,createTime,dataInfoOperator,dataInfoState,dataInfoTime,entryWay,id,infoSource,infoType,modifyTime,provinceId,pubDate,pubDateStr,sourceUrl,summary,title
1,1580615780000,,0,1580615780000,1,1512,央视新闻,2,1580615780000,32,江苏省,1580615640000,20-02-02 11:54,http://m.weibo.cn/2656274875/4467488152562884,1月30日10时至31日17时，徐州市新增新型冠状病毒病原学检测阳性19例，其中睢宁县10人为同一待确认病例密切接触者，出现一人传染多人现象。因宿迁市宿城区耿车镇等乡镇与睢宁县接壤，人员相互流动较为频繁，传染危险性增加。,江苏出现1名患者感染10人案例
1,1580615416000,,0,1580615416000,1,1508,央视新闻,1,1580615416000,63,青海省,1580614794000,20-02-02 11:39,http://m.weibo.cn/2656274875/4467484604556801,"2月2日，根据《新型冠状病毒感染的肺炎诊疗方案（试行第四版）》规定，2名疑似病例患者马某、张某，病例样本经青海省疾病预防控制中心实验室复核检测，呈新型冠状病毒核酸阳性。结合患者临床表现、流行病学史，经省级医疗救治专家组会诊研判，确认为新型冠状病毒感染的肺炎确诊病例。截至2月2日11时，青海省累计报告新型冠状病毒感染的肺炎确诊病例11例，均为武汉输入性新型冠状病毒感染的肺炎确诊病例，均在定点医疗机构接受治疗。目前除1例患者属重症病例外，其他10例患者病情稳定，密切接触者已开展追踪调查和医学观察。
",青海省新增2例确诊病例
1,1580613979000,,0,1580613979000,1,1506,人民网,1,1580613979000,35,福建省,1580613831000,20-02-02 11:23,http://m.weibo.cn/2286908003/4467480564765736,2月1日0-24时，福建省报告新增新型冠状病毒感染的肺炎确诊病例15例。其中：福州市5例（晋安区3例、福清市2例）；厦门市1例（集美区1例）；漳州市1例（芗城区1例）；泉州市5例（晋江市5例）；三明市1例（将乐县1例）；莆田市2例（城厢区2例）。报告新增新型冠状病毒感染的肺炎疑似病例39例。其中：福州市6例（仓山区1例、晋安区1例、罗源县1例、福清市3例）；厦门市8例（湖里区2例、集美区2例、同安区1例、翔安区2例、漳州市龙海市1例）；漳州市2例（芗城区1例、诏安县1例）；泉州市4例（永春县1例、晋江市3例）；三明市3例（梅列区1例、大田县1例、沙县1例）；莆田市10例（城厢区5例、荔城区1例、湄洲岛北岸2例、仙游县2例）；南平市3例（延平区2例、武夷山市1例）；龙岩市1例（新罗区1例）；宁德市2例（周宁县2例）。截至2月1日24时，福建省累计报告新型冠状病毒感染的肺炎确诊病例159例（危重症5例、重症7例，无死亡病例）。现有报告新型冠状病毒感染的肺炎疑似病例共99例。目前，确诊、疑似病例的密切接触者已解除医学观察265人，尚有3613人正在接受医学观察。,福建新增15例累计159例
1,1580613614000,,0,1580613614000,1,1501,央视新闻,1,1580613614000,1,1580613370000,20-02-02 11:16,http://m.weibo.cn/2656274875/4467478631680795,2月2日，菲律宾卫生部长杜克在记者会上宣布，菲律宾确诊第二例新型冠状病毒感染肺炎病例。该病例为一名44岁的中国男性公民，是菲律宾首例确诊患者的同伴，他于1月25日和首例患者一起到马尼拉圣拉扎罗医院就诊，其后他病情恶化，于2月1日死亡。,中国之外首次出现死亡病例
1,1580613139000,,0,1580613139000,1,1500,人民网,1,1580613139000,61,陕西省,1580612867000,20-02-02 11:07,http://m.weibo.cn/2286908003/4467476525817859,"截至2月2日10时，陕西新增15例新型冠状病毒感染的肺炎确诊病例，新增重症患者1例，新增疑似病例77例。新增确诊病例中，西安市8例、宝鸡市1例、咸阳市1例、铜川市1例、汉中市2例、安康市2例。陕西累计报告新型冠状病毒感染的肺炎确诊病例116例，其中输入性病例82例，密切接触者31例，无明确接触史病例3例。累计确诊病例中，西安市47例、宝鸡市7例、咸阳市9例、铜川市6例、渭南市5例、延安市7例、榆林市1例、汉中市15例、安康市16例、商洛市2例、韩城市1例。全省现有疑似病例201例。全省新增密切接触者830人，累计4394人，均集中医学观察。新增解除密切接触者264人，累计解除密切接触者809人。
",陕西新增15例累计116例
1,1580612178000,,0,1580612178000,1,1496,人民日报,1,1580612178000,11,北京市,1580612019000,20-02-02 10:53,http://m.weibo.cn/2803301701/4467472964959734,"2月1日12时至24时，北京市新增15例新型冠状病毒感染的肺炎病例，11例有湖北及其他省份接触史，4例为确诊病例的密切接触者，其中2例既有湖北及其他省份接触史又是确诊病例的密切接触者。2例否认湖北接触史，正在进一步核实。均已送至定点医疗机构进行救治。截至2月1日24时，北京市累计确诊病例183例，其中死亡1例，出院9例，173例在定点医院进行隔离治疗。东城区3例、西城区17例、朝阳区35例、海淀区41例、丰台区16例、石景山区4例、门头沟区1例、房山区2例、通州区13例、顺义区6例、昌平区12例、大兴区21例、怀柔区1例、外地来京人员11例。平谷区、密云区、延庆区尚未有病例。
",北京新增15例含10月婴儿
1,1580611820000,,0,1580611820000,1,1492,人民日报,2,1580611820000,42,湖北省,1580611476000,20-02-02 10:44,http://m.weibo.cn/2803301701/4467470687393173,"最早收治新型冠状病毒感染的肺炎患者的金银潭医院的口罩和防护服十分紧张。现急需爱心捐助下列防护物资：医用外科口罩，N95口罩，一次性医用口罩，医用防护服，一次性手术衣，防护面罩，防冲击眼罩，一次性圆帽。
",武汉金银潭医院接受社会捐赠公告
1,1580610862000,,0,1580610862000,1,1484,人民网,1,1580610862000,15,内蒙古自治区,1580610275000,20-02-02 10:24,http://m.weibo.cn/2286908003/4467465654617559,"2020年2月1日10时至2日10时，内蒙古自治区报告新型冠状病毒感染的肺炎新增确诊病例4例，新增疑似病例5例为呼和浩特市2例、包头市土右旗1例、呼伦贝尔市陈巴尔虎旗病例1例、鄂尔多斯市达拉特旗病例1例。截至2020年2月2日10时, 内蒙古自治区累计报告新型冠状病毒感染的肺炎确诊病例27例，其中：呼和浩特市新城区2例，包头市5例（昆都仑区3例、土右旗2例），呼伦贝尔市2例（满洲里市1例已痊愈出院、牙克石市1例），兴安盟乌兰浩特市1例，通辽市经济开发区1例，赤峰市2例（松山区1例、林西县1例），锡林郭勒盟2例（锡林浩特市1例，二连浩特市1例），乌兰察布市2例（四子王旗1例，化德县1例），鄂尔多斯市6例（东胜区1例、鄂托克前旗1例、达拉特旗4例），巴彦淖尔市3例（五原县2例、临河区1例），乌海市海勃湾区1例。　　确诊病例中，危重病例2例（牙克石市1例、锡林浩特市1例）；重症病例为包头市昆都仑区2例。　　疑似病例7例（呼和浩特市玉泉区1例、托克托县1例；包头市土右旗1例、呼伦贝尔市陈巴尔虎旗1例、鄂尔多斯市达拉特旗3例）。均在定点医院接受隔离治疗。目前，追踪到的密切接触者1110人，尚在接受医学观察中。当日解除医学观察2人。
",内蒙古新增4例累计确诊27例
1,1580610018000,,0,1580610018000,1,1483,人民网,1,1580610018000,13,河北省,1580609530000,20-02-02 10:12,http://m.weibo.cn/2286908003/4467462524896471,"2月2日，河北省首批新型冠状病毒感染的肺炎患者经过省、市级医疗救治专家组的科学指导和定点收治医院的精心治疗，已符合治愈标准，正式出院3例。保定患者为母子二人，母亲30岁，儿子9岁，长居武汉，原籍保定安国市，于2020年1月19日由武汉回到保定安国。根据患者流行病学史和临床表现，1月24日收入保定市人民医院进行救治，1月25日，该母子同时被确诊为新型冠状病毒感染的肺炎病例，目前母子二人临床症状消失，各项化验指标恢复正常。廊坊患者，男，48岁，某物业公司工作，因发热、咳嗽于1月24日到医院就诊，1月25日收入廊坊市第三人民医院救治。1月26日经专家组会诊确诊为新型冠状病毒感染的肺炎病例。经治疗，临床症状消失，各项化验指标恢复正常。
",好消息！河北首批3名患者治愈出院
1,1580608575000,,0,1580608575000,1,1478,央视新闻,1,1580608575000,46,海南省,1580608084000,20-02-02 09:48,http://m.weibo.cn/2656274875/4467456460684277,"2月1日0-24时，海南省报告新型冠状病毒感染的肺炎新增确诊病例6例，新增重症病例1例，新增死亡病例0例，新增出院病例0例。截至2月1日24时，海南省累计报告新型冠状病毒感染的肺炎确诊病例63例，重症病例10例，死亡病例1例，出院病例1例。截至2月1日24时，追踪到密切接触者1643人，已解除医学观察616人，尚有1027人正在接受居家或集中医学观察。
",海南新增6例，累计63例
1,1580608099000,,0,1580608099000,1,1477,人民网,1,1580608099000,12,天津市,1580607898000,20-02-02 09:44,http://m.weibo.cn/2286908003/4467455680188813,截至2月2日6时，天津新增4例新型冠状病毒感染的肺炎确诊病例，确诊病例增至45例。截至目前，天津累计报告新型冠状病毒感染的肺炎确诊病例45例，其中男性28例，女性17例；危重型3例，重型14例，普通型28例；疑似病例为124例。累计排查密切接触者301人，其中已确诊12人，已解除医学观察13人，尚有276人正在接受医学观察。,天津新增4例，累计45例
1,1580608099000,,0,1580608099000,1,1476,人民日报,2,1580608099000,100,全国,1580607850000,20-02-02 09:44,http://m.weibo.cn/2803301701/4467455478690170,"邱海波表示，目前尚无二次感染病例。现在已有对新型冠状病毒感染病人的监测，这些病人感染两三周后就可产生抗体，尤其是痊愈病人。一般抗体会持续半年或更长，所以半年内再感染可能性非常小，除非病毒又变异了，但目前还无证据。  
",国家卫健委专家组成员邱海波：目前没有新型冠状病毒变异证据
1,1580607622000,,0,1580607622000,1,1474,人民网,1,1580607622000,22,吉林省,1580607200000,20-02-02 09:33,http://m.weibo.cn/2286908003/4467452752188554,"2月1日0-24时，吉林新增确诊病例6例，均为长春市报告，其中2例为东丰县转诊病例。截至2月1日24时，吉林累计报告确诊病例23例，长春市治愈出院1例，现在院隔离治疗确诊病例22例。其中长春市12例，吉林市3例，延边州2例，松原市2例，通化市1例，四平市1例，公主岭市1例。在院治疗确诊病例有18例为普通病例，4例为重症病例。2月1日0-24时，全省原有疑似病例转为确诊病例6例，新增疑似病例10例，现有疑似病例14例，已全部隔离治疗，目前正在进一步明确诊断。
",吉林新增6例，累计23例
1,1580607253000,,0,1580607253000,1,1471,人民网,1,1580607253000,43,湖南省,1580606809000,20-02-02 09:26,http://m.weibo.cn/2286908003/4467451112558429,"2020年2月1日0-24时，湖南省报告新型冠状病毒感染的肺炎新增确诊病例74例，新增重症病例2例，新增死亡病例0例，新增出院病例5例。截至2月1日24时，湖南省累计报告新型冠状病毒感染的肺炎确诊病例463例，累计报告重症病例56例，死亡病例0例，出院病例8例。目前追踪到密切接触者9599人，已解除医学观察1353人，尚有8246人正在接受医学观察。
",湖南新增确诊74例，累计463例
1,1580606774000,,0,1580606774000,1,1470,人民网,1,1580606774000,64,宁夏回族自治区,1580606628000,20-02-02 09:23,http://m.weibo.cn/2286908003/4467450357733629,"2月1日0时至24时，宁夏回族自治区报告新增新型冠状病毒感染的肺炎确诊病例2例，新增疑似病例7例。截至2月1日24时，全区累计报告确诊病例28例，其中银川市16例（兴庆区5例、金凤区6例、西夏区3例、永宁县2例）、吴忠市7例（利通区4例、红寺堡区3例）、固原市2例（原州区2例）、中卫市2例（沙坡头区2例）、宁东1例（宁东镇）；现有重症病例4例；共有疑似病例8例。目前累计追踪到密切接触者884人，正在接受集中或居家隔离医学观察。
",宁夏新增确诊2例，累计28例
1,1580606774000,,0,1580606774000,1,1467,人民日报,2,1580606774000,100,全国,1580606254000,20-02-02 09:17,http://m.weibo.cn/2803301701/4467448784522553,"据新华社，临床发现，部分新型冠状病毒感染者首发症状仅为腹泻，专家在感染者大便和肛拭子中已发现病毒核酸，确诊患者粪便中检出病毒RNA阳性。专家提醒，应注意消化系统传播新型冠状病毒风险，做好相关防护。研究团队提醒，轻症患者居家隔离时，应格外重视手卫生，同时尽可能避免与家庭成员共用卫生间。如无单独卫生间，每次使用后，可通过乙醚、75%乙醇、含氯消毒剂、过氧乙酸和氯仿等脂溶剂，做好居家隔离消毒。武汉大学人民医院临床学科在诊疗过程中还发现，部分患者存在胸部影像与临床症状相背离的现象。不必为了解病情进展频繁复査胸部CT，以临床症状为导向复查胸部CT即可。
",专家提醒注意消化系统传播风险
1,1580606415000,,0,1580606415000,1,1466,人民网,1,1580606415000,33,浙江省,1580606060000,20-02-02 09:14,http://m.weibo.cn/2286908003/4467447971360307,"2020年2月1日0-24时，浙江省报告新型冠状病毒感染的肺炎新增确诊病例62例，新增出院病例8例。其中：新增确诊病例中，杭州市12例、宁波市11例、温州市24例、嘉兴市1例、绍兴市3例、台州市5例、丽水市6例；新增出院病例中，杭州市2例、温州市2例、绍兴市1例、台州市3例。截至2月1日24时，浙江省累计报告新型冠状病毒感染的肺炎确诊病例661例，现有重症病例52例（其中危重12例），累计出院23例。目前，全省共追踪到密切接触者11961人，已解除医学观察1008人，尚有10397人正在接受医学观察。
",浙江新增确诊62例，累计661例
1,1580605937000,,0,1580605937000,1,1463,人民网,1,1580605937000,1,1580605660000,20-02-02 09:07,http://m.weibo.cn/2286908003/4467446293046079,"当地时间2月2日上午，韩国通报3例新型冠状病毒感染的肺炎确诊病例。至此，韩国自1月20日确诊首例新型冠状病毒感染的肺炎以来，累计确诊病例已达15例。
",韩国累计确诊病例增至15例
1,1580605937000,,0,1580605937000,1,1462,人民网,1,1580605937000,36,江西省,1580605650000,20-02-02 09:07,http://m.weibo.cn/2286908003/4467446251935270,"2020年2月1日0-24时，江西省报告新型冠状病毒感染的肺炎新增确诊病例47例，新增治愈出院病例1例（新余市1例）。截至2月1日24时，江西省累计报告新型冠状病毒感染的肺炎确诊病例333例，其中重症病例32例，治愈出院病例10例。目前追踪到密切接触者9254人，解除医学观察825人，尚有8429人正在接受医学观察。
",江西新增确诊47例，累计333例
1,1580605937000,,0,1580605937000,1,1461,人民网,1,1580605937000,34,安徽省,1580605592000,20-02-02 09:06,http://m.weibo.cn/2286908003/4467446008352154,"2020年2月1日0-24时，安徽省报告新增确诊病例43例，新增疑似病例82例，新增危重病例1例，新增治愈出院2例。截至2月1日24时，安徽省在院治疗确诊病例335例。2月2日即将治愈出院2例（芜湖、宣城各1例）。累计医学观察密切接触者7481人。
",安徽新增43例，累计340例
1,1580605937000,,0,1580605937000,1,1457,人民网,1,1580605937000,23,黑龙江省,1580605459000,20-02-02 09:04,http://m.weibo.cn/2286908003/4467445450680613,"2月1日0-24时，黑龙江省报告新型冠状病毒感染的肺炎新增确诊病例15例。黑河市为报告首例确诊病例。新增重症病例1例。新增出院病例2例。新增疑似病例79例。截至2月1日24时，黑龙江省累计报告新型冠状病毒感染的肺炎确诊病例95例，出院病例2例为哈尔滨市传染病医院治愈患者。累计报告疑似病例172例。全省当日发热门诊诊疗人数2520人。目前追踪到密切接触者2931人, 已解除医学观察1008人,尚有1807人正在接受医学观察。",黑龙江新增15例，累计95例
1,1580605457000,,0,1580605457000,1,1454,央视新闻,1,1580605457000,42,湖北省,1580605171000,20-02-02 08:59,http://m.weibo.cn/2656274875/4467444242513457,"截至2月1日24时，湖北黄冈市新型冠状病毒感染的肺炎病例过千例，为武汉外全国第二个破千的城市。湖北省累计报告新型冠状病毒感染的肺炎病例9074例（其中：武汉市4109例、黄石市252例、十堰市212例、襄阳市441例、宜昌市353例、荆州市333例、荆门市329例、鄂州市278例、孝感市749例、黄冈市1002例、咸宁市246例、随州市384例、恩施州105例、仙桃市140例、天门市99例、潜江市35例、神农架林区7例），已治愈出院215例，死亡294例（其中：武汉市224例、黄石市2例、宜昌市1例、荆州市4例、荆门市7例、鄂州市13例、孝感市14例、黄冈市15例、随州3例、仙桃市3例、天门市7例、潜江市1例）。目前湖北全省仍在院治疗8565例（其中：重症1118例、危重症444例），均在定点医疗机构接受隔离治疗。累计追踪密切接触者48571人，尚在接受医学观察43121人。
",黄冈累计确诊病例过千
1,1580605457000,,0,1580605457000,1,1453,人民网,1,1580605457000,44,广东省,1580605141000,20-02-02 08:59,http://m.weibo.cn/2286908003/4467444116380676,"截至2月1日24时，广东累计报告新型冠状病毒感染的肺炎确诊病例604例。1日当天广东新增确诊病例84例，新增确诊病例中，广州市38例、深圳市26例、东莞市6例、珠海市3例、中山市3例、惠州市3例、肇庆市1例、湛江市1例、韶关市1例、梅州市1例、佛山市1例。有2418名密切接触者正在接受医学观察。截至2月1日24时，604例确诊病例中，危重20例,重症50例，普通病例522例，累计出院12例，无死亡病例。
",广东新增确诊84例，累计604例
1,1580604975000,,0,1580604975000,1,1448,央视新闻,1,1580604975000,32,江苏省,1580604810000,20-02-02 08:53,http://m.weibo.cn/2656274875/4467442728700426,2020年2月1日0-24时，江苏省报告新型冠状病毒感染的肺炎新增确诊病例34例。其中，南京市7例、无锡市6例、徐州市7例、常州市1例、苏州市4例、南通市5例、淮安市1例、盐城市2例、镇江市1例。新增出院病例1例。所有病例均已在定点医院救治，病情稳定。已追踪到密切接触者744人，均在接受隔离医学观察。截至2月1日24时，江苏省累计报告新型冠状病毒感染的肺炎确诊病例236例，其中，重症病例1例，出院病例6例。目前，江苏省追踪到密切接触者3992人，已解除医学观察216人，尚有3776人在接受医学观察。,江苏新增34例，累计236例
1,1580604975000,,0,1580604975000,1,1447,人民日报,1,1580604975000,37,山东省,1580604609000,20-02-02 08:50,http://m.weibo.cn/2803301701/4467441885228766,"2020年2月1日12—24时，山东省报告新型冠状病毒感染的肺炎新增确诊病例19例，累计确诊病例225例（含重症病例15例，危重症病例1例，出院5例，无死亡病例）；新增疑似病例33例，现有疑似病例81例。截至目前，追踪到密切接触者7277人，已解除医学观察997人，诊断为疑似或确诊86例，尚有6194人正在接受医学观察。
",山东新增病例19例，累计病例225例
1,1580604618000,,0,1580604618000,1,1442,人民网,1,1580604618000,51,四川省,1580604111000,20-02-02 08:41,http://m.weibo.cn/2286908003/4467439796701281,"四川省新型冠状病毒感染的肺炎病例确认专家组确认四川新增新型冠状病毒感染的肺炎病例24例。截至2月1日24时，四川累计报告新型冠状病毒感染的肺炎确诊病例231例，涉及21个市（州）。231名患者中，危重5人,死亡1人，治愈出院3人。正在接受医学观察5038人，已解除医学观察334人。
",四川新增24例累，计231例
1,1580604618000,,0,1580604618000,1,1441,人民网,1,1580604618000,52,贵州省,1580604039000,20-02-02 08:40,http://m.weibo.cn/2286908003/4467439498668883,"2020年2月1日0-24时，全省新型冠状病毒感染的肺炎新增9例确诊病例。其中，外地来黔人员7例、本省常住人口2例。贵阳市2例、遵义市1例、安顺市2例、毕节市1例、黔东南州2例、黔南州1例。截至2月1日24时，全省累计报告新型冠状病毒感染的肺炎病例38例。其中，外地来黔人员23例，本省常住人口15例；治愈出院2例，病情平稳28例，重症6例，危重症2例；男性22例，女性16例；年龄最大80岁，最小10岁；贵阳市6例（1例已治愈），遵义市5例，六盘水8例，安顺市2例，毕节市4例，铜仁市3例（1例已治愈），黔东南州4例，黔南州5例，黔西南州1例。现有疑似病例65例。累计追踪密切接触者567人，12人转为确诊病例，3人转为疑似病例，已解除医学观察50人，尚在接受医学观察502人。
",贵州新增9例，确诊38例
1,1580604160000,,0,1580604160000,1,1438,人民网,1,1580604160000,65,新疆维吾尔自治区,1580603764000,20-02-02 08:36,http://m.weibo.cn/2286908003/4467438344863570,"2月1日0-24时，兵团报告新型冠状病毒感染的肺炎新增确诊病例3例，新增重症病例0例，新增危重症病例0例，新增死亡病例0例，新增出院病例0例。其中：新增确诊病例中，兵团第九师3例。截至2月1日24时，新疆（含兵团）累计报告新型冠状病毒感染的肺炎确诊病例21例，现有重症病例4例、危重症病例1例，累计死亡病例0例，累计出院病例0例。其中：确诊病例中，乌鲁木齐市8例、伊犁州5例、吐鲁番市1例、阿克苏地区1例，兵团第七师1例、兵团第八师石河子市1例、兵团第九师4例；现有重症病例中，乌鲁木齐市2例、伊犁州2例；现有危重症病例中，乌鲁木齐市1例。目前尚有1151人正在接受医学观察。
",新疆新增3例，累计21例
1,1580603659000,,0,1580603659000,1,1435,人民日报,1,1580603659000,41,河南省,1580603489000,20-02-02 08:31,http://m.weibo.cn/2803301701/4467437187425854,"2020年2月1日0-24时，河南省新增新型冠状病毒感染的肺炎确诊病例71例,新增出院病例1例。新增确诊病例中，郑州市9例、开封市3例、洛阳市2例、焦作市5例、平顶山市3例、鹤壁市2例、许昌市1例、漯河市2例、南阳市9例、商丘市7例、信阳市18例、周口市2例、驻马店市6例、永城市1例、邓州市1例。截至2月1日24时，全省累计报告新型冠状病毒感染的肺炎确诊病例493例，现有重症病例32例，现有危重病例12例，累计死亡病例2例，累计治愈病例4例，现有疑似病例754例。其中：确诊病例中，郑州市65例、开封市11例、洛阳市7例、平顶山市14例、安阳市24例、鹤壁市8例、新乡市21例、焦作市7例、濮阳市3例、许昌市13例、漯河市16例、三门峡市7例、南阳市62例、商丘市36例、信阳市88例、周口市40例、驻马店市46例、滑县1例、长垣市2例、永城市8例、邓州市14例。目前累计追踪到密切接触者11012人，2月1日已解除观察1263人，诊断为疑似17人，共有7162人正在接受医学观察。
",河南新增71例，累计确诊493例
1,1580603659000,,0,1580603659000,1,1434,人民网,2,1580603659000,33,浙江省,1580603329000,20-02-02 08:28,http://m.weibo.cn/2286908003/4467436520630657,"浙江温州决定自2020年2月1日24时起至2月8日24时，在全市范围实行村（居）民出行管控措施。全市每户家庭每两天可指派1名家庭成员出门采购生活物资，其他人员除生病就医、疫情防控工作需要和在保障公共事业运行、群众生活及其他涉及重要国计民生的相关企业上班外，原则上不要外出。
",温州实施出行管控：每家每两天可指派1人出门采购
1,1580603178000,,0,1580603178000,1,1429,央视新闻,1,1580603178000,37,山东省,1580603003000,20-02-02 08:23,http://m.weibo.cn/2656274875/4467435149271096,"昨晚，山东威海市乳山市1例新型冠状病毒感染的肺炎确诊病例痊愈出院。患者女，39岁，是威海首例确诊患者的妻子。经治疗，该患者病情持续改善，呼吸道症状好转，肺部影像学显示病灶明显吸收，体温正常，各项化验指标均正常。两次核酸检测均为阴性，已符合出院标准。
",好消息！山东第4例确诊患者治愈出院
