adoptType,createTime,dataInfoOperator,dataInfoState,dataInfoTime,entryWay,id,infoSource,infoType,modifyTime,provinceId,pubDate,pubDateStr,sourceUrl,summary,title
1,1580197216000,zhuotingting,1,1580198289000,1,630,人民日报,1,1580197216000,37,山东省,1580197125000,20-01-28 15:38,http://m.weibo.cn/2803301701/4465732773013064,"2020年1月28日0—12时，山东省报告新型冠状病毒感染的肺炎新增确诊病例8例，其中：青岛市2例（市北区）、枣庄市3例（市中区）、烟台市2例（莱山区、芝罘区各1例），菏泽市1例（巨野县）。目前有疑似病例47例，其中：青岛市19例，威海、德州、滨州、菏泽市各5例，潍坊、泰安、聊城市各2例，枣庄、临沂市各1例。
",山东新增确诊 8 例，累计确诊 95 例
1,1580196015000,yuting,1,1580198716000,1,626,央视新闻,1,1580196015000,15,内蒙古自治区,1580195740000,20-01-28 15:15,http://m.weibo.cn/2656274875/4465726964761419,"今天，内蒙古自治区新型冠状病毒感染肺炎防控工作指挥部发布，截至1月28日9时, 我区累计报告新型冠状病毒感染的肺炎确诊病例15例，疑似病例2例。其中：15例确诊病例中，呼和浩特市2例（新城区），包头市3例（昆都仑区），呼伦贝尔市2例（满洲里市1例、牙克石市1例），兴安盟1例（乌兰浩特市），通辽市1例（经济开发区），赤峰市2例（松山区、林西县），锡林郭勒盟2例（锡林浩特市1例、二连浩特市1例），鄂尔多斯市2例（东胜区1例、鄂托克前旗1例）。累计报告疑似病例2例，呼伦贝尔市额尔古纳市、巴彦淖尔市五原县各1例。目前，所有病例均在定点医院接受隔离治疗。追踪到的342名密切接触者正在接受医学观察，其他密切接触者正在紧急排查中。
",内蒙古累计确诊病例 15 例
1,1580195414000,yuting,1,1580198710000,1,625,央视新闻,1,1580195414000,61,陕西省,1580195306000,20-01-28 15:08,http://m.weibo.cn/2656274875/4465725144039280,截至1月28日14时，陕西新增11例新型冠状病毒感染的肺炎确诊病例。新增确诊病例中，西安市3例、宝鸡市3例、渭南市2例、汉中市1例、安康市1例、商洛市1例。陕西累计报告新型冠状病毒感染的肺炎确诊病例46例，其中西安市15例、宝鸡市3例、咸阳市4例、铜川市5例、渭南市3例、延安市2例、汉中市4例、安康市8例、商洛市2例。全省新增密切接触者340人，累计899人，均集中医学观察。,陕西新增 11 例，累计确诊 46 例
0,1580201507000,yuting,1,1580203713000,0,639,广西梧州卫健委,1,1580201507000,45,广西壮族自治区,1580194232000,20-01-28 14:50,http://wjw.wuzhou.gov.cn/gggs/20200128-2386155.shtml,1月28日下午，从我市第三人民医院传来好消息，经医护人员精心诊治和护理，市第三人民医院收治的一名新型冠状病毒感染的肺炎患者救治情况良好，符合出院标准，于当天出院。这是梧州市经过自治区专家组确认救治后成功治愈的首例新型冠状病毒感染的肺炎患者。,广西梧州首例确诊患者治愈出院
1,1580194215000,yuting,1,1580198697000,1,621,人民日报,1,1580194215000,53,云南省,1580193666000,20-01-28 14:41,http://m.weibo.cn/2803301701/4465718265403999,"截至1月28日12时，云南省累计报告新型冠状病毒感染的肺炎确诊病例44例，新增12例，均为输入病例，现有重症5例，无二代病例，无死亡病例。其中，昆明市12例、丽江市6例、德宏州2例、保山市4例、曲靖市2例、玉溪市5例、红河州2例、西双版纳州6例、大理州3例、昭通市2例。报告疑似病例125例。密切接触者医学观察558人。
",云南新增确诊 12 例
1,1580193618000,,0,1580193618000,1,619,人民日报,2,1580193618000,11,北京市,1580193176000,20-01-28 14:32,http://m.weibo.cn/2803301701/4465716214789211,"27日，北京师范大学心理学部联合该校学生心理咨询与服务中心，紧急开通心理支持热线和网络辅导服务。适用于急需情绪疏导和心理支持的人群。热线电话均由有丰富经验的咨询师接听，每次30分钟左右。热线电话 4001888976，开放时间为每天6时至24时。
",北师大开通疫情心理支持热线
1,1580191820000,,0,1580191820000,1,616,央视新闻,2,1580191820000,12,天津市,1580191694000,20-01-28 14:08,http://m.weibo.cn/2656274875/4465709994074745,"今天，天津首批针对新型冠状病毒感染肺炎的“2019-nCoV病毒检测试剂盒”，共计1万人份已发往武汉。这些试剂盒经检测合格后，将用于一线检测。据介绍，生产企业目前试剂原材料供货稳定，正加班加点开足马力生产，计划1月底前完成5万人份的生产目标，全部无偿提供给湖北等地。
",天津首批病毒检测试剂盒发往武汉
1,1580190919000,zhuotingting,1,1580191442000,1,614,央视新闻,1,1580190919000,1,1580190507000,20-01-28 13:48,http://m.weibo.cn/2656274875/4465705019492720,"28日，泰国卫生部向媒体透露，泰国新增6例新型冠状病毒肺炎确诊病例，目前总共确诊病例达到14例。
",泰国新增6例，累计14例
1,1580190919000,zhuotingting,1,1580191445000,1,613,人民日报,1,1580190919000,36,江西省,1580190480000,20-01-28 13:48,http://m.weibo.cn/2803301701/4465704902378725,"1月28日，江西新余市人民医院接诊的一例新型冠状病毒感染的肺炎患者救治情况良好，符合出院标准，于当日中午出院。这也是江西第三例治愈新型冠状病毒感染的肺炎患者出院。据了解，该患者为女性，37岁，江西新余人，在武汉从事销售工作。1月13日回到江西新余，1月20日因发烧、咳嗽前往新余市人民医院就诊，后被确诊为新型冠状病毒感染的肺炎。
",江西第3例治愈患者出院
1,1580189718000,zhuotingting,1,1580191451000,1,610,央视新闻,1,1580189718000,31,上海市,1580189479000,20-01-28 13:31,http://m.weibo.cn/2656274875/4465700704335058,记者28日从上海卫健委获悉，经上海市专家组会诊，上海第4例新型冠状病毒感染的肺炎患者痊愈出院。据悉，金某某，女，21岁，上海市户籍，有武汉居住史，因发热就诊，1月22日被确认为新型冠状病毒感染的肺炎确诊病例入住市公共卫生临床中心。经治疗，该例患者两次核酸检测为阴性，符合国家卫健委新型冠状病毒感染肺炎确诊病例解除隔离和出院标准。,上海第4例治愈病人出院
1,1580187917000,zhuotingting,1,1580188305000,1,607,人民日报,1,1580187917000,35,福建省,1580187464000,20-01-28 12:57,http://m.weibo.cn/2803301701/4465692252819831,"1月27日15时—1月28日8时，福建省报告新增新型冠状病毒感染的肺炎确诊病例14例，均为输入性病例。其中：厦门市1例（湖北省武汉市1例）；泉州市3例（丰泽区1例、鲤城区1例、南安市1例）；三明市4例（沙县2例、宁化县1例、永安市1例）；莆田市4例（荔城区3例、湄洲湾北岸1例）；南平市1例（浦城县1例）；龙岩市1例（永定区1例）。报告新增新型冠状病毒感染的肺炎疑似病例37例。截至1月28日8时，福建省累计报告新型冠状病毒感染的肺炎确诊病例73例（危重症2例、重症5例，无死亡病例）。目前，确诊、疑似病例的密切接触者已解除医学观察15人，尚有1266人正在接受医学观察。
",福建新增确诊14例，累计73例
1,1580184617000,,0,1580184617000,1,603,央视新闻,2,1580184617000,100,全国,1580184335000,20-01-28 12:05,http://m.weibo.cn/2656274875/4465679133041663,"世卫组织在26日、27日的新型冠状病毒报告中，将新型冠状病毒疫情全球范围风险改为高风险。世卫组织表示，此前发布的报告中，错误地将新型冠状病毒疫情对全球风险总结为中等，其实为高风险。新型冠状病毒疫情对中国造成非常高风险，对区域造成高风险。
",世卫组织：新型冠状病毒疫情对全球构成高风险
0,1580186432000,,0,1580186432000,0,605,人民日报,2,1580186432000,100,全国,1580183884000,20-01-28 11:58,https://m.weibo.cn/status/4465676972765962,据北京铁路 ，自1月28日至2月26日对部分旅客列车采取临时停运措施，已购买以下停运列车车票的旅客可在30日内（含当日）办理全额退票手续。点击查看详细车次,1月28日起至2月底，北京铁路部分列车临时停运
1,1580183715000,zhuotingting,1,1580184011000,1,599,人民日报,1,1580183715000,12,天津市,1580183514000,20-01-28 11:51,http://m.weibo.cn/2803301701/4465675684706033,"记者从市疾控中心获悉，至1月28日9时，天津市新增1例新型冠状病毒感染的肺炎确诊病例，确诊病例增至24例。患者刘某某，男，21岁，居住于天津市西青区，患者在武汉某高校上学，1月11日从武汉回津。1月23日患者发热，先后就诊于市人民医院、医科大学总医院，1月28日经市专家组确诊为第24例病例，为轻症病例。目前已转至市海河医院治疗，病情平稳。截至目前，我市累计发现新型冠状病毒感染的肺炎病例24例，其中男性19例，女性5例；重症17例，轻症7例；无危重及死亡病例。
",天津新增1例确诊病例，累计确诊24例
1,1580183715000,zhuotingting,1,1580191458000,1,598,人民日报,1,1580183715000,21,辽宁省,1580183307000,20-01-28 11:48,http://m.weibo.cn/2803301701/4465674816422526,"2020年1月27日15时30分至1月28日10时30分，辽宁省新增3例输入性新型冠状病毒感染的肺炎确诊病例。其中沈阳市1例、丹东市1例、辽阳市1例，均属普通型病例。辽阳市属首发病例。截至2020年1月28日10时30分，辽宁省累计报告新型冠状病毒感染的肺炎确诊病例30例，重型病例14例。其中确诊病例中，沈阳市8例、大连市5例、本溪市2例、丹东市5例、营口市1例、辽阳市1例、铁岭市2例、朝阳市2例、盘锦市2例、葫芦岛市2例。目前30名患者均在定点医疗机构隔离治疗，病情稳定。其中，27例病例发病前有武汉居住史或旅行史，3例病例为武汉输入病例家属。目前累计追踪到密切接触者449人，已解除医学观察21人，现有428人正在接受医学观察，其余正在追踪中。
",辽宁新增确诊3例，累计确诊30例
0,1580183235000,,0,1580183235000,0,597,人民日报,2,1580183235000,100,全国,1580183012000,20-01-28 11:43,https://m.weibo.cn/detail/4465673071759541,国家卫健委通报出院标准：临床症状缓解，体温正常，两次核酸检测都呈阴性才能确保出院没有传染性。,卫健委通报出院标准
0,1580184160000,,0,1580184160000,0,601,央视新闻,2,1580184160000,42,湖北省,1580182349000,20-01-28 11:32,https://weibo.com/2656274875/IryoX4PUB?from=page_1002062656274875_profile&wvr=6&mod=weibotime&type=comment#_rnd1580184095474,今天，华中科技大学附属协和医院的15名被感染医护人员经过治疗后，临床症状得到有效控制。经专家组讨论后，协和医院首批共有3名医护人员符合出院标准，于上午11时许出院。,武汉协和医院首批3名被感染医护人员出院
0,1580182583000,,0,1580182583000,0,596,人民日报,2,1580182583000,100,全国,1580181304000,20-01-28 11:15,https://m.weibo.cn/detail/4465666511453374,国家卫生健康委医政医管局副局长焦雅辉在28日新闻发布会上表示，截至今晚约有6000人医疗队支援湖北。若有战，召必回！,截至今晚约6000人医疗队支援湖北
0,1580182482000,,0,1580182482000,0,593,人民日报,2,1580182482000,100,全国,1580180706000,20-01-28 11:05,https://m.weibo.cn/detail/4465663894906763,截至1月27日24时，国家卫生健康委收到30个省（区、市）累计报告确诊病例4515例，现有重症病例976例，累计死亡病例106例，累计治愈出院60例。现有疑似病例6973例。,全国累计治愈出院60例
1,1580180717000,zhuotingting,1,1580181982000,1,590,央视新闻,1,1580180717000,1,1580180051000,20-01-28 10:54,http://m.weibo.cn/2656274875/4465661160296770,"据斯里兰卡媒体报道，斯里兰卡卫生部27日宣布，一名目前在该国就医的43岁中国女性，新型冠状病毒测试呈阳性。该人员来自湖北，本月19日以游客身份入境斯里兰卡，并于本月25日入住当地传染病院。
",斯里兰卡确诊首例病例
1,1580179817000,zhuotingting,1,1580180091000,1,588,人民日报,1,1580179817000,63,青海省,1580179301000,20-01-28 10:41,http://m.weibo.cn/2803301701/4465658014272585,"1月27日0-24时，青海省报告新型冠状病毒感染的肺炎新增确诊病例2例，新增重症病例0例，新增死亡病例0例，新增出院病例0例。其中：西宁市报告2例新增确诊病例。其他市州无报告病例。截至1月27日24时，青海省累计报告新型冠状病毒感染的肺炎确诊病例6例，重症病例0例，死亡病例0例，出院病例0例。其中，确诊病例中，西宁市6例，其他市州无报告病例。目前追踪到密切接触者40人，尚有192人正在接受医学观察。青海省共排查来青人员7358人。
",青海新增确诊2例，累计6例
0,1580177793000,zhuotingting,1,1580177940000,0,586,国家卫生健康委员会,1,1580177793000,100,全国,1580177438000,20-01-28 10:10,http://www.nhc.gov.cn/xcs/yqfkdt/202001/ec9fe7ea987d467d9462e7db509079e6.shtml,"1月27日0-24时，30个省（区、市）报告新增确诊病例1771例，新增重症病例515例，新增死亡病例26例（湖北省24例、北京市1例、海南省1例），新增治愈出院病例9例，新增疑似病例2077例。
截至1月27日24时，国家卫生健康委收到30个省（区、市）累计报告确诊病例4515例，现有重症病例976例，累计死亡病例106例，累计治愈出院60例。现有疑似病例6973例。
目前累计追踪到密切接触者47833人，当日解除医学观察914人，现有44132人正在接受医学观察。
累计收到港澳台地区通报确诊病例：香港特别行政区8例，澳门特别行政区7例，台湾地区5例。",全国新增确诊病例1771例
0,1580176585000,zhuotingting,1,1580177945000,0,583,人民日报,1,1580176585000,43,湖南省,1580176406000,20-01-28 09:53,https://weibo.com/2803301701/IrxKDfmId?from=page_1002062803301701_profile&wvr=6&mod=weibotime&type=comment#_rnd1580176510364,"2020年1月27日0-24时，湖南省报告新型冠状病毒感染的肺炎新增确诊病例43例，新增重症病例10例，新增死亡病例0例，新增出院病例0例。其中：
新增确诊病例中，长沙市2例、衡阳市3例、株洲市2例、湘潭市2例、邵阳市3例、岳阳市10例、常德市7例、益阳市3例、郴州市1例、永州市3例、怀化市5例、娄底市2例；新增重症病例中，长沙市1例、衡阳市1例、邵阳市2例、常德市2例、益阳市1例、怀化市2例、娄底市1例。
截至1月27日24时，湖南省累计报告新型冠状病毒感染的肺炎确诊病例143例，重症病例31例（另有1例重症病例转归为普通病例），死亡病例0例，出院病例0例。其中：
确诊病例中，长沙市24例、衡阳市7例、株洲市7例、湘潭市6例、邵阳市11例、岳阳市17例、常德市19例、益阳市10例、郴州市7例、永州市7例、怀化市16例、娄底市9例、湘西自治州3例；
重症病例中，长沙市8例、衡阳市2例、株洲市1例、湘潭市1例、邵阳市3例、岳阳市1例、常德市4例、益阳市2例、永州市3例、怀化市5例、娄底市1例。目前追踪到密切接触者2387人，已解除医学观察51人，尚有2336人正在接受医学观察。",湖南新增确诊43例，湖南累计确诊143例
0,1580176087000,zhuotingting,1,1580177952000,0,577,央视新闻,1,1580176087000,22,吉林省,1580175915000,20-01-28 09:45,https://weibo.com/2656274875/IrxHrh51G?from=page_1002062656274875_profile&wvr=6&mod=weibotime&type=comment#_rnd1580176024120,"1月27日0-24时，吉林省报告新增新型冠状病毒感染的肺炎确诊病例2例，其中吉林市1例，公主岭市1例。
吉林市新增病例，男，57岁，常居深圳，1月19日从深圳坐高铁到天津途径武汉，停车数分钟，22日乘高铁到吉林市。1月27日收入定点医疗机构隔离治疗，初步诊断为普通轻型病例，目前患者病情尚平稳。
公主岭市新增病例，女，50岁，1月17日从湖北省仙桃市乘车到公主岭市，中间在武汉汉口火车站换乘火车。1月27日收入定点医疗机构隔离治疗，初步诊断为普通轻型病例，目前病情稳定。
截至1月27日24时，吉林省累计报告新型冠状病毒感染的肺炎病例8例，其中长春市1例，吉林市3例，松原市2例，四平市1例，公主岭市1例。目前累计追踪到密切接触者184人，均在接受医学观察。",吉林新增2例，累计确诊8例
0,1580175911000,zhuotingting,1,1580177956000,0,575,央视新闻,1,1580175911000,46,海南省,1580175809000,20-01-28 09:43,https://weibo.com/2656274875/IrxGth8KF?from=page_1002062656274875_profile&wvr=6&mod=weibotime&type=comment#_rnd1580175853068,"1月27日16:00-28日7:00，海南省新型冠状病毒感染的肺炎新增确诊病例7例，新增重症病例0例，新增死亡病例0例，新增出院病例0例。新增确诊病例中，海口市1例、三亚市3例、琼海市1例、东方市1例、琼中县1例。
截至1月28日7:00，海南省累计报告新型冠状病毒感染的肺炎确诊病例40例，重症病例5例，死亡病例1例，出院病例0例。确诊病例中，海口市7例、三亚市14例、儋州市5例、万宁市7例、琼海市1例、东方市1例、临高县1例、陵水县1例、澄迈县2例、琼中县1例。截至1月28日7:00，追踪到密切接触者558人，已解除医学观察31人，尚有528人正在接受居家医学观察。",海南新增7例，累计确诊40例
0,1580175596000,zhuotingting,1,1580177960000,0,574,人民日报,1,1580175596000,67,澳门,1580175370000,20-01-28 09:36,https://weibo.com/2803301701/IrxDLFQt3?from=page_1002062803301701_profile&wvr=6&mod=weibotime&type=comment#_rnd1580175537924,澳门新增第7例输入性新型冠状病毒感染病例，患者为67岁女性，武汉居民，退休人士。患者于1月22日从武汉乘坐高铁到广州，23日乘坐城轨由广州到珠海，经关闸口岸入境澳门，26日晚开始自觉有发热，27日早上由消防救护车送到仁伯爵综合医院特别急症室，下午其新型冠状病毒检测结果呈阳性。目前，患者情况一般。,澳门新增确诊1例，累计7例
0,1580175116000,zhuotingting,1,1580177966000,0,568,央视新闻,1,1580175116000,15,内蒙古自治区,1580174884000,20-01-28 09:28,https://weibo.com/2656274875/IrxAu8RfW?from=page_1002062656274875_profile&wvr=6&mod=weibotime&type=comment#_rnd1580175057414,"1月27日0-24时，内蒙古自治区报告新型冠状病毒感染的肺炎新增确诊病例2例。报告新增疑似病例1例。其中：新增2例确诊病例中包头市1例、赤峰市1例；呼伦贝尔市的额尔古纳市新增疑似病例1例。
截至1月27日24时,内蒙古自治区累计报告新型冠状病毒感染的肺炎确诊病例13例，疑似病例2例。其中：13例确诊病例中包括,包头市昆都仑区3例，呼伦贝尔市2例（满洲里市1例、牙克石市1例），兴安盟乌兰浩特市1例，通辽市经济开发区1例，赤峰市2例（松山区1例、林西县1例），锡林郭勒盟2例（锡林浩特市1例，二连浩特市1例），鄂尔多斯市2例（东胜区1例、鄂托克前旗1例）​；疑似病例2例中呼伦贝尔市的额尔古纳市新增疑似病例1例、锡林郭勒盟苏尼特左旗疑似病例1例。
均在定点医院接受隔离治疗。目前追踪到密切接触者334人，正在接受医学观察。",内蒙古新增2例，累计确诊13例
0,1580174887000,zhuotingting,1,1580180127000,0,565,人民日报,1,1580174887000,64,宁夏回族自治区,1580174732000,20-01-28 09:25,https://weibo.com/2803301701/Irxz9nfZb?from=page_1002062803301701_profile&wvr=6&mod=weibotime&type=comment#_rnd1580174841225,"2020年1月27日0-24时，宁夏全区报告新型冠状病毒感染的肺炎新增确诊病例4例。
截止1月27日24时，宁夏累计报告新型冠状病毒感染的肺炎确诊病例11例,其中银川市7例、吴忠市2例、固原市1例、中卫市1例，疑似病例0例。全区累计追踪到密切接触者471例，全部实行隔离医学观察。",宁夏新增确诊4例，宁夏累计确诊11例
0,1580174778000,zhuotingting,1,1580180132000,0,564,央视新闻,1,1580174778000,65,新疆维吾尔自治区,1580174424000,20-01-28 09:20,https://weibo.com/2656274875/IrxxpdRx5?from=page_1002062656274875_profile&wvr=6&mod=weibotime&type=comment#_rnd1580174715525,"1月27日0-24时，新疆维吾尔自治区报告新型冠状病毒感染的肺炎新增确诊病例5例，新增重症病例1例，新增死亡病例0例，新增出院病例0例。其中：吐鲁番市、第七师、第八师石河子市为报告首例确诊病例；其他2个州市新增确诊病例中，乌鲁木齐市1例、伊犁州1例；新增重症病例中，伊犁州1例。
截至1月27日24时，新疆累计报告新型冠状病毒感染的肺炎确诊病例10例，现有重症病例2例，累计死亡病例0例，累计出院病例0例。
目前累计追踪到密切接触者204人，当日解除医学观察9人，现有195人正在接受医学观察。",新疆新增5例，累计确诊10例
0,1580174474000,zhuotingting,1,1580180137000,0,563,人民日报,1,1580174474000,44,广东省,1580174188000,20-01-28 09:16,https://weibo.com/2803301701/Irxvsowh0?from=page_1002062803301701_profile&wvr=6&mod=weibotime&type=comment#_rnd1580174338743,"    2020年1月27日，我省报告新型冠状病毒感染的肺炎新增确诊病例42例，其中新增重症病例3例，新增出院病例2例，无新增危重病例和死亡病例。
    新增病例中，广州市12例、深圳市13例、汕头市3例、佛山市4例、梅州市2例、惠州市3例、中山市2例、清远市2例、揭阳市1例。
    截至1月27日24时，我省累计报告新型冠状病毒感染的肺炎确诊病例188例，其中重症病例23例，危重病例6例，无死亡病例，出院病例4例。
我省累计确诊的188例病例中，男性93例，女性95例，年龄介于11月龄-85岁之间。无医务 
   人员感染病例。其中，广州市51例、深圳市49例、珠海市12例、汕头市5例、佛山市18例、韶关市4例、梅州市3例、惠州市11例、汕尾市1例、东莞市2例、中山市6例、阳江市8例、湛江市5例、肇庆市4例、清远市5例、揭阳市4例。
　目前追踪到密切接触者1019人，均在进行医学观察。",广东新增确诊42例，广东累计确诊188例
1,1580174413000,,0,1580174413000,1,561,人民日报,2,1580174413000,100,全国,1580174127000,20-01-28 09:15,http://m.weibo.cn/2803301701/4465636312468420,国家卫建委与国家中医药管理局公布《新型冠状病毒感染的肺炎诊疗方案（试行第四版）》：①潜伏期一般3-7天，最长不超过14天；②多数患者预后良好，儿童病例症状相对较轻；③儿童及婴幼儿也有发病；④新型冠状病毒与SARS同源性达85%。,第四版诊疗方案公布：新型冠状病毒可通过接触传播
1,1580174413000,zhuotingting,1,1580180142000,1,560,人民日报,1,1580174413000,33,浙江省,1580174048000,20-01-28 09:14,http://m.weibo.cn/2803301701/4465635986243007,"2020年1月27日0-24时，浙江省报告新型冠状病毒感染的肺炎新增确诊病例45例，新增重症病例14例。其中：新增确诊病例中，杭州市5例、宁波市4例、温州市28例、嘉兴市3例、绍兴市1例、金华市2例、丽水市2例；新增重症病例中，杭州市6例、温州市3例、嘉兴市2例、绍兴市2例、舟山市1例。截至1月27日24时，浙江省累计报告新型冠状病毒感染的肺炎确诊病例173例，重症病例31例（累计34例，其中3例已转轻症）。其中：确诊病例中，杭州市32例、宁波市17例、温州市60例、湖州市3例、嘉兴市11例、绍兴市7例、金华市7例、衢州市5例、舟山市4例、台州市22例、丽水市5例；重症病例中，杭州市8例、宁波市1例、温州市7例、嘉兴市5例、绍兴市4例、衢州市1例、舟山市1例、台州市4例。
目前，全省共追踪到密切接触者4952人，已解除医学观察182人，尚有4715人正在接受医学观察。
",浙江新增确诊45例，浙江累计报告173例
1,1580173820000,zhuotingting,1,1580180147000,1,555,人民日报,1,1580173820000,62,甘肃省,1580173688000,20-01-28 09:08,http://m.weibo.cn/2803301701/4465634471323038,"2020年1月27日0-24时，甘肃省报告新型冠状病毒感染的肺炎新增确诊病例5例，新增重症病例1例。其中：金昌市、天水市为报告首例确诊病例，兰州市新增确诊病例3例，新增重症病例中，兰州市1例。截至1月27日24时，甘肃省累计报告新型冠状病毒感染的肺炎确诊病例19例，重症病例4例。其中：确诊病例中，兰州市11例、白银市1例、临夏州2例、定西市1例、张掖市1例、陇南市1例、金昌市1例、天水市1例；重症病例中，兰州市3例、定西市1例。
目前，追踪到密切接触者277人，已解除隔离2人，其余均正在接受医学观察。
",甘肃新增确诊5例，甘肃累计确诊19例
