adoptType,createTime,dataInfoOperator,dataInfoState,dataInfoTime,entryWay,id,infoSource,infoType,modifyTime,provinceId,pubDate,pubDateStr,sourceUrl,summary,title
1,1581206656000,,0,1581206656000,1,3091,人民网,1,1581206656000,13,河北省,1581206363000,20-02-09 07:59,http://m.weibo.cn/2286908003/4469965828235926,"2020年2月8日0—24时，河北省报告新型冠状病毒肺炎新增确诊病例11例。截至2月8日24时，河北省累计报告确诊病例206例。
",河北新增确诊11例，累计确诊206例
1,1581200300000,,0,1581200300000,1,3085,人民日报,1,1581200300000,42,湖北省,1581200219000,20-02-09 06:16,http://m.weibo.cn/2803301701/4469940054769086,"2020年2月8日0时-24时，湖北省新增新型冠状病毒肺炎病例2147例。截至2020年2月8日24时，湖北省累计报告新型冠状病毒肺炎病例27100例。
",湖北新增确诊2147，累计确诊27100
0,1581205529000,,0,1581205529000,0,3087,山西卫健委,1,1581205529000,14,山西省,1581191788000,20-02-09 03:56,http://wjw.shanxi.gov.cn/wjywl02/24775.hrh,2020年2月8日0时至24时，山西省报告新增新型冠状病毒肺炎确诊病例12例。截至2月8日24时，山西省11个市累计报告新型冠状病毒肺炎确诊病例115例。,山西新增确诊12，累计确诊115
1,1581206747000,,0,1581206747000,1,3093,云南卫健委,1,1581206747000,53,云南省,1581177600000,20-02-09 00:00,http://ynswsjkw.yn.gov.cn/wjwWebsite/web/doc/UU158120469383659749,"2月8日12时至24时，云南省报告新型冠状病毒肺炎新增病例2例（昭通市）。全省累计报告确诊病例140例，除治愈出院者外，现均在定点医院接受隔离治疗。
				",云南新增确诊2，累计确诊140
1,1581210317000,,0,1581210317000,1,3122,江西卫健委,1,1581210317000,36,江西省,1581177600000,20-02-09 00:00,http://hc.jiangxi.gov.cn/doc/2020/02/09/138450.shtml,2020年2月8日0-24时，江西省报告新型冠状病毒肺炎新增确诊病例42例。截至2月8日24时，江西省累计报告新型冠状病毒肺炎确诊病例740例。,江西新增确诊42例，累计确诊740例      
1,1581211638000,,0,1581211638000,1,3141,天津卫健委,1,1581211638000,12,天津市,1581177600000,20-02-09 00:00,http://wsjk.tj.gov.cn/art/2020/2/9/art_87_70691.html,"2020年2月8日0-24时，天津市报告新型冠状病毒感染的肺炎新增确诊病例7例，新增危重型病例1例，新增重型病例0例，新增死亡病例0例，新增出院病例2例。截至2月8日24时，天津市累计报告新型冠状病毒感染的肺炎确诊病例88例，危重型病例6例，重型病例29例，死亡病例1例，出院病例4例。
",天津新增确诊7例，累计确诊88例
1,1581214600000,,0,1581214600000,1,3163,陕西卫健委,1,1581214600000,61,陕西省,1581177600000,20-02-09 00:00,http://sxwjw.shaanxi.gov.cn/art/2020/2/9/art_9_67878.html,截至2月9日10时，陕西新增13例新冠肺炎确诊病例。陕西累计报告新冠肺炎确诊病例208例（20例治愈出院）。,陕西新增确诊13例，累计确诊208例
1,1581219469000,,0,1581219469000,1,3188,北京卫健委,1,1581219469000,11,北京市,1581177600000,20-02-09 00:00,http://wjw.beijing.gov.cn/xwzx_20031/xwfb/202002/t20200209_1626973.html,"2月8日0时至24时，本市新增11例新冠肺炎确诊病例。截至2月8日24时,本市累计确诊病例326例。其中出院37例，死亡2例，287例在定点医院进行隔离治疗。",北京新增确诊11例，累计确诊326例
1,1581233224000,,0,1581233224000,1,3227,云南卫健委,1,1581233224000,53,云南省,1581177600000,20-02-09 00:00,http://ynswsjkw.yn.gov.cn/wjwWebsite/web/doc/UU158123176127641423,2月9日0时至12时，云南省报告新型冠状病毒肺炎新增病例1例（昆明市）。全省累计报告确诊病例141例，除治愈出院者外，现均在定点医院接受隔离治疗。现有危重3例，重症14例，治愈出院18例，疑似病例127例，密切接触者医学观察2886人，无死亡病例。,云南省报告新型冠状病毒肺炎新增病例1例
1,1581233224000,,0,1581233224000,1,3228,天津卫健委,1,1581233224000,12,天津市,1581177600000,20-02-09 00:00,http://wsjk.tj.gov.cn/art/2020/2/9/art_87_70703.html,"至2月9日6时，天津市新增新冠肺炎确诊病例2例，累计确诊病例90例。第89例患者，女，34岁，居住于天津市宝坻区史各庄镇，宝坻百货大楼男装区临时销售人员，无武汉旅行或工作史。
",天津市新增2例确诊病例 累计确诊病例90例
1,1581234662000,,0,1581234662000,1,3233,山东卫健委,1,1581234662000,37,山东省,1581177600000,20-02-09 00:00,http://wsjkw.shandong.gov.cn/ztzl/rdzt/qlzhfkgz/tzgg/202002/t20200209_2517573.html,"2020年2月9日0-12时，山东省报告新型冠状病毒肺炎新增确诊病例9例，累计确诊病例444例(含重症病例26例，危重症病例7例，治愈出院53例，死亡病例1例);新增疑似病例8例，现有疑似病例85例。
         
            
              
   
        
            
            
            
				
					
						 

						
					
			
          ",山东省报告新型冠状病毒肺炎新增确诊病例9例
1,1581235883000,,0,1581235883000,1,3242,重庆卫健委,1,1581235883000,50,重庆市,1581177600000,20-02-09 00:00,http://wsjkw.cq.gov.cn/yqxxyqtb/20200209/252980.html,"2020年2月9日0—12时，重庆市报告新冠肺炎新增确诊病例4例，新增出院病例2例。新增确诊病例中，万州区1例、大足区1例、忠县2例；新增出院病例中，巴南区1例、长寿区1例。
        ",重庆市报告新冠肺炎新增确诊病例4例
1,1581243366000,,0,1581243366000,1,3262,重庆卫健委,1,1581243366000,50,重庆市,1581177600000,20-02-09 00:00,http://wsjkw.cq.gov.cn/yqxxyqtb/20200209/252995.html,"重庆又有9例确诊病例痊愈出院，目前共有50例出院。目前，全市共有50名新型冠状病毒感染的肺炎患者治愈出院。
            
        ", 好消息！重庆又有9例确诊病例痊愈出院，目前共有50例出院 
1,1581244502000,,0,1581244502000,1,3270,山东卫健委,1,1581244502000,37,山东省,1581177600000,20-02-09 00:00,http://wsjkw.shandong.gov.cn/ztzl/rdzt/qlzhfkgz/tzgg/202002/t20200209_2517629.html,"济南市新增确诊病例1例:患者吴某某，女，34岁，江西省南昌市人，济南市工作，家居济南市历下区姚家街道万科城。
            
              
   
        
            
            
            
				
					
						 

						
					
			
          ",山东省济南市新增确诊病例1例
1,1581171979000,,0,1581171979000,1,3069,人民网,2,1581171979000,100,全国,1581171492000,20-02-08 22:18,http://m.weibo.cn/2286908003/4469819564546724,"2月8日元宵夜，500名医护人员从大连出发乘四架包机飞赴武汉，以全力支援湖北医疗救治。据悉，2月9日，另500名医护人员也将从沈阳出发驰援武汉。他们舍弃团圆的元宵节，奔赴疫情一线，致敬疫情中的逆行者，愿平安凯旋！
",辽宁500名医护元宵夜飞赴武汉
1,1581162009000,,0,1581162009000,1,3039,辽宁卫健委,2,1581162009000,21,辽宁省,1581161340000,20-02-08 19:29,http://wsjk.ln.gov.cn/wst_zdzt/xxgzbd/yqtb/202002/t20200208_3736669.html,"2020年2月8日13时至18时，辽宁省新增2例新型冠状病毒肺炎确诊病例,其中沈阳市1例、锦州市1例，均为普通型病例。沈阳市治愈出院1例。
截至2020年2月8日18时，辽宁省累计报告新型冠状病毒肺炎确诊病例105例，治愈出院8例。105例确诊病例中，沈阳市26例、大连市16例、鞍山市3例、本溪市3例、丹东市7例、锦州市10例、营口市1例、阜新市7例、辽阳市3例、铁岭市3例、朝阳市6例、盘锦市11例、葫芦岛市9例。
目前97名在治患者均在定点医疗机构隔离治疗，其中重型病例14例，危重型病例1例。 97名在治患者中，67例病例为输入性病例，30例病例为本地感染病例。
目前累计追踪到密切接触者1944人，已解除医学观察1113人，现有788人正在接受医学观察,43人正在追踪中。

                   
    
                
                  
                    
                     
                  
                
      
        ",辽宁新增确诊2例，累计确诊105例
1,1581160698000,,0,1581160698000,1,3037,人民网,2,1581160698000,64,宁夏回族自治区,1581160220000,20-02-08 19:10,http://m.weibo.cn/2286908003/4469772286619509,"2月8日，经过宁夏新型冠状病毒肺炎诊疗组精心治疗，经专家组会诊后，在医护人员护送下，宁夏10名新冠肺炎确诊患者今日正式解除隔离，治愈出院。
",宁夏新增10例治愈出院
1,1581158055000,,0,1581158055000,1,3030,人民日报,2,1581158055000,42,湖北省,1581157893000,20-02-08 18:31,http://m.weibo.cn/2803301701/4469762527051423,"武汉雷神山医院各项准备工作正有序进行中，今日将交付使用，首批医疗队员已经进驻，全力救治已确诊的新型冠状病毒肺炎患者。雷神山医院开设1500张床位、32个病区，除重症病区外，病房均为2人间。该院只设住院不设门诊。
",雷神山医院今日交付使用
1,1581154460000,,0,1581154460000,1,3018,央视新闻,1,1581154460000,1,1581153856000,20-02-08 17:24,http://m.weibo.cn/2656274875/4469745598201538,"日本横滨附近海域，搭乘了3700多人的“钻石公主号”游轮上目前有64人确诊感染新冠肺炎。感染人数持续增加，游轮上的全部人员被要求在船上隔离14天。
",日本邮轮累计确诊64人
1,1581151007000,,0,1581151007000,1,3006,广东卫健委,1,1581151007000,44,广东省,1581149123000,20-02-08 16:05,http://wsjkw.gd.gov.cn/xxgzbdfk/yqtb/content/post_2888193.html,"截至2月8日12时，全省累计报告新型冠状病毒感染的肺炎确诊病例1095例。8日当天0-12时全省新增确诊病例20例。新增确诊病例中，惠州市6例、佛山市4例、深圳市3例、广州市3例、茂名市2例、珠海市1例、江门市1例。
                            
                        ",广东新增确诊20例，累计确诊1095例
1,1581148577000,,0,1581148577000,1,2981,人民网,2,1581148577000,100,全国,1581148070000,20-02-08 15:47,http://m.weibo.cn/2286908003/4469721326007093,"7日，国家邮政局召开部分快递企业专题电话会议指出，分阶段确定快递企业恢复生产目标，积极推进网购快递的生产恢复，以满足百姓网购快递需求。计划在本月中旬，快递业生产要恢复到正常产能的4成以上；到本月下旬，根据疫情变化和形势发展，继续提高产能比重。
",国家邮政局：快递2月中旬恢复到4成以上
1,1581148264000,,0,1581148264000,1,2980,央视新闻,2,1581148264000,100,全国,1581147921000,20-02-08 15:45,http://m.weibo.cn/2656274875/4469720700817749,"今天，上海疫情防控工作发布会介绍：卫生防疫专家强调，目前可以确定的新冠肺炎传播途径主要为直接传播、气溶胶传播和接触传播。直接传播是指患者喷嚏、咳嗽、说话的飞沫，呼出的气体近距离直接吸入导致的感染；气溶胶传播是指飞沫混合在空气中，形成气溶胶，吸入后导致感染；接触传播是指飞沫沉积在物品表面，接触污染手后，再接触口腔、鼻腔、眼睛等粘膜，导致感染。
",新冠肺炎传播途径含气溶胶传播
1,1581146782000,,0,1581146782000,1,2926,人民日报,2,1581146782000,42,湖北省,1581146375000,20-02-08 15:19,http://m.weibo.cn/2803301701/4469714216219398,"从湖北省新冠肺炎疫情防控指挥部了解到，今天省内企业自产N95口罩超过12万只，预计下周可实现N95口罩自产自足，供需矛盾大大缓解。 
",今天湖北企业自产N95口罩超12万，预计下周可自产自足
1,1581146321000,,0,1581146321000,1,2904,央视新闻,1,1581146321000,34,安徽省,1581146203000,20-02-08 15:16,http://m.weibo.cn/2656274875/4469713495107536,"今天，安徽有12名新冠肺炎患者治愈出院。其中，合肥2例，铜陵2例，淮北1例，宿州1例，阜阳2例，淮南1例，六安1例，马鞍山2例。截至今天，安徽累计治愈出院的人数已达有59名。
",安徽新增治愈12，累计治愈59
1,1581146321000,,0,1581146321000,1,2903,人民日报,2,1581146321000,100,全国,1581145907000,20-02-08 15:11,http://m.weibo.cn/2803301701/4469712253795751,"新闻发言人介绍新型冠状病毒感染的肺炎统一称谓为“新型冠状病毒肺炎”，简称“新冠肺炎”，英文简称“NCP”。 
",国家卫健委：新冠肺炎英文简称NCP
1,1581144621000,,0,1581144621000,1,2874,辽宁卫健委,1,1581144621000,21,辽宁省,1581144060000,20-02-08 14:41,http://wsjk.ln.gov.cn/wst_zdzt/xxgzbd/yqtb/202002/t20200208_3736524.html,"2020年2月7日22时至2月8日13时，辽宁省新增4例新型冠状病毒感染的肺炎确诊病例,其中大连市2例，1例为普通型病例、1例为重型病例；辽阳市1例，为普通型病例；锦州市1例，为普通型病例。
截至2020年2月8日13时，辽宁省累计报告新型冠状病毒感染的肺炎确诊病例103例，治愈出院7例。
目前累计追踪到密切接触者1923人，已解除医学观察1113人，现有767人正在接受医学观察,43人正在追踪中。

                   
    
                
                  
                    
                     
                  
                
      
        ",辽宁新增确诊4例，累计确诊103例
1,1581140054000,,0,1581140054000,1,2868,央视新闻,1,1581140054000,31,上海市,1581139609000,20-02-08 13:26,http://m.weibo.cn/2656274875/4469685842067584,"上海市卫健委今天通报：11例新冠肺炎病例，经定点医疗机构医护人员精心诊治和护理，专家组评估，认为符合国家卫生健康委最新的新冠肺炎确诊病例解除隔离和出院标准，于今日出院。
",上海新增治愈11，累计治愈41
1,1581131898000,,0,1581131898000,1,2851,人民网,1,1581131898000,35,福建省,1581131753000,20-02-08 11:15,http://m.weibo.cn/2286908003/4469652887505637,2月7日0-24时，福建省报告新增新型冠状病毒肺炎确诊病例15例。报告新增新型冠状病毒肺炎疑似病例38例。截至2月7日24时，福建省累计报告新型冠状病毒肺炎确诊病例239例。累计治愈出院病例20例，目前住院病例219例。目前，确诊、疑似病例的密切接触者已解除医学观察3249人，尚有3330人正在接受医学观察。,福建新增15例，累计239例
1,1581132362000,,0,1581132362000,1,2852,内蒙古卫健委,1,1581132362000,15,内蒙古自治区,1581130813000,20-02-08 11:00,http://wjw.nmg.gov.cn/doc/2020/02/08/291119.shtml,2020年2月7日9时至8日10时，内蒙古自治区报告新型冠状病毒感染的肺炎新增确诊病例2例。截至2月8日10时，内蒙古自治区累计报告新型冠状病毒感染的肺炎确诊病例52例，目前，尚在接受医学观察的密切接触者1451人。当日解除医学观察113人。      ,内蒙古新增确诊病例2例，累计52例
1,1581131078000,,0,1581131078000,1,2848,人民网,1,1581131078000,11,北京市,1581130542000,20-02-08 10:55,http://m.weibo.cn/2286908003/4469647812542639,"2月7日0时至24时，北京市新增18例新型冠状病毒感染的肺炎病例。截至2月7日24时，北京市累计确诊病例315例。其中出院34例，死亡2例，279例在定点医院进行隔离治疗。
",北京新增18例，累计315例
1,1581127457000,,0,1581127457000,1,2838,人民网,1,1581127457000,52,贵州省,1581127229000,20-02-08 10:00,http://m.weibo.cn/2286908003/4469633911975612,"2020年2月7日12—24时，全省新型冠状病毒感染的肺炎新增确诊病例8例,新增治愈出院病例0例。其中：新增确诊病例中，遵义市3例，毕节市4例，黔西南州1例。截至2月7日24时，全省累计报告新型冠状病毒感染的肺炎病例89例。目前累计追踪密切接触者1285人，已解除医学观察564人，尚在接受医学观察678人。",贵州新增8例，累计89例
1,1581126496000,,0,1581126496000,1,2835,人民网,2,1581126496000,42,湖北省,1581126308000,20-02-08 09:45,http://m.weibo.cn/2286908003/4469630049543788,据国家卫健委数据统计，2月7日0—24时，全国湖北以外地区新增确诊病例558例，连续第4日呈下降态势。而过去4日这一数据分别为：890例(3日)、731例(4日)、707例(5日)、696例(6日)。,湖北以外地区新增病例连降4天
1,1581126496000,,0,1581126496000,1,2834,人民网,1,1581126496000,64,宁夏回族自治区,1581126103000,20-02-08 09:41,http://m.weibo.cn/2286908003/4469629193798369,2月8日，宁夏应对新型冠状病毒感染肺炎疫情工作指挥部发布最新全区新型冠状病毒感染的肺炎疫情通报。2020年2月7日0-24时，全区报告新增确诊病例2例；新增疑似病例4例。截至2月7日24时，全区累计报告确诊病例45例。目前累计追踪到密切接触者2079人，累计解除医学观察757人。,宁夏新增2例，累计45例
1,1581124817000,,0,1581124817000,1,2823,央视新闻,1,1581124817000,44,广东省,1581124588000,20-02-08 09:16,http://m.weibo.cn/2656274875/4469622834888584,截至2月7日24时，广东省累计报告新型冠状病毒感染的肺炎确诊病例1075例。2月7日当天全省新增确诊病例57例。截至2月7日24时，在院的977例确诊病例中，轻型42例，普通型813例，重型85例，危重型37例。新增出院29例，累计出院97例。累计死亡1例。,广东新增57例，累计确诊1075例
1,1581124817000,,0,1581124817000,1,2822,人民网,1,1581124817000,63,青海省,1581124571000,20-02-08 09:16,http://m.weibo.cn/2286908003/4469622763441202,2020年2月7日0-24时，青海省报告新型冠状病毒感染的肺炎新增确诊病例0例，新增重症病例0例，新增死亡病例0例，新增出院病例0例。 截至2月7日24时，青海省累计报告新型冠状病毒感染的肺炎确诊病例18例， 目前累计追踪到密切接触者411人，已解除医学观察41人，尚有370人正在接受医学观察。,2月7日青海无新增病例，青海累计确诊18例
1,1581124817000,,0,1581124817000,1,2816,央视新闻,1,1581124817000,36,江西省,1581123889000,20-02-08 09:04,http://m.weibo.cn/2656274875/4469619902951551,2020年2月7日0-24时，江西省报告新型冠状病毒感染的肺炎新增确诊病例37例，新增治愈出院病例10例。截至2月7日24时，江西省累计报告新型冠状病毒感染的肺炎确诊病例698例，其中重症病例61例，治愈出院病例55例。目前追踪到密切接触者17856人，解除医学观察6783人，尚有11073人正在接受医学观察。,江西新增37例，累计确诊698例
1,1581123977000,,0,1581123977000,1,2810,人民网,1,1581123977000,41,河南省,1581123562000,20-02-08 08:59,http://m.weibo.cn/2286908003/4469618531860175,"2020年2月7日0-24时，河南省新增新型冠状病毒感染的肺炎确诊病例67例,新增出院病例29例，新增死亡病例1例。截至2月7日24时，全省累计报告新型冠状病毒感染的肺炎确诊病例981例，现有重症病例58例，现有危重病例28例，累计死亡病例4例，累计治愈病例97例。目前累计追踪到密切接触者20928人，2月7日已解除观察3516人，诊断为疑似56人，共有10187人正在接受医学观察。",河南新增67例，累计981例
1,1581123977000,,0,1581123977000,1,2809,央视新闻,1,1581123977000,33,浙江省,1581123537000,20-02-08 08:58,http://m.weibo.cn/2656274875/4469618426626283,2020年2月7日0-24时，浙江省报告新型冠状病毒感染的肺炎新增确诊病例42例，新增出院病例29例。截至2月7日24时，浙江省累计报告新型冠状病毒感染的肺炎确诊病例1048例，现有重症病例78例（其中危重25例）。全省共追踪到密切接触者25936人，当日解除医学观察1864人，尚有14526人正在接受医学观察。,浙江新增42例，累计确诊1048例
1,1581123977000,,0,1581123977000,1,2803,人民网,1,1581123977000,51,四川省,1581122962000,20-02-08 08:49,http://m.weibo.cn/2286908003/4469616015191183,2月7日0-24时，我省新型冠状病毒肺炎新增确诊病例19例，新增治愈出院病例13例，无新增死亡病例。截至2月7日24时，我省累计报告新型冠状病毒肺炎确诊病例363例。363名确诊患者中，正在住院隔离治疗312人（其中危重20人），已治愈出院50人，死亡1人。当日解除医学观察1237人，现有7207人正在接受医学观察。,四川新增19例，累计363例
1,1581123977000,,0,1581123977000,1,2802,央视新闻,1,1581123977000,43,湖南省,1581122933000,20-02-08 08:48,http://m.weibo.cn/2656274875/4469615893625003,2020年2月7日0-24时，湖南省报告新型冠状病毒感染的肺炎新增确诊病例31例，新增重症病例11例，新增死亡病例0例，新增出院病例28例。截至2月7日24时，湖南省累计报告新型冠状病毒感染的肺炎确诊病例803例，累计报告重症病例106例，现有重症病例57例，死亡病例0例，出院病例119例。目前追踪到密切接触者20119人，已解除医学观察10778人，尚有9341人正在接受医学观察。,湖南新增31例，累计确诊803例
1,1581123021000,,0,1581123021000,1,2797,央视新闻,1,1581123021000,32,江苏省,1581122764000,20-02-08 08:46,http://m.weibo.cn/2656274875/4469615188708391,2020年2月7日0-24时，江苏省报告新型冠状病毒肺炎新增确诊病例31例。截至2月7日24时，江苏省累计报告新型冠状病毒肺炎确诊病例439例。其中，轻型病例18例，普通型病例415例，重型病例4例，危重型病例2例。出院病例43例。目前，江苏省追踪到密切接触者8533人，已解除医学观察3077人，尚有5456人在接受医学观察。,江苏新增31例，累计确诊439例
1,1581123021000,,0,1581123021000,1,2796,人民网,1,1581123021000,23,黑龙江省,1581122722000,20-02-08 08:45,http://m.weibo.cn/2286908003/4469615009000259,2020年2月7日0-24时，黑龙江省报告新型冠状病毒感染的肺炎新增疑似病例117例，无症状感染者13例，新增确诊病例5例。新增重症病例11例。新增出院病例4例。新增死亡病例2例。截至2月7日24时，黑龙江省报告新型冠状病毒感染的肺炎现有疑似病例234例。无症状感染者13例。目前追踪到密切接触者7965人，已解除医学观察3817人，尚有4121人正在接受医学观察。,黑龙江新增确诊 5例，累计234例
1,1581123021000,,0,1581123021000,1,2795,人民网,1,1581123021000,34,安徽省,1581122604000,20-02-08 08:43,http://m.weibo.cn/2286908003/4469614513948374,2020年2月7日0-24时，安徽省报告新增确诊病例68例，新增疑似病例70例，新增治愈出院13例。截至2月7日24时，安徽省累计报告确诊病例733例，累计治愈出院病例47例，无死亡病例，累计医学观察密切接触者15611人。,安徽新增68例，累计733例
1,1581122062000,,0,1581122062000,1,2791,央视新闻,1,1581122062000,100,全国,1581121762000,20-02-08 08:29,http://m.weibo.cn/2656274875/4469610981930220,"2月7日0—24时，31个省（自治区、直辖市）和新疆生产建设兵团报告新增治愈出院510例（湖北298例），解除医学观察的密切接触者26702人，累计报告累计治愈出院2050例。
",全国累计治愈出院超2千例
1,1581122062000,,0,1581122062000,1,2789,央视新闻,1,1581122062000,100,全国,1581121080000,20-02-08 08:18,http://m.weibo.cn/2656274875/4469608121852346,2月7日0—24时，31个省（自治区、直辖市）和新疆生产建设兵团报告，新增确诊病例3399例（湖北2841例），新增重症病例1280例（湖北1193例），新增死亡病例86例（湖北81例，黑龙江2例，北京、河南、甘肃各1例），新增疑似病例4214例（湖北2073例）。  当日新增治愈出院510例（湖北298例），解除医学观察的密切接触者26702人。 ,全国累计确诊新冠肺炎34546例，新增3399例
1,1581121219000,,0,1581121219000,1,2785,人民网,1,1581121219000,45,广西壮族自治区,1581120598000,20-02-08 08:09,http://m.weibo.cn/2286908003/4469606099822822,"2月7日0-24时，广西共新增新型冠状病毒感染的肺炎确诊病例11例。新增疑似病例123例，现有疑似病例295例。目前广西全区累计报告确诊病例183例，累计出院病例17例。目前累计追踪到密切接触者8877例，尚在接受医学观察4072例。
",广西新增11例，累计183例
1,1581121219000,,0,1581121219000,1,2783,人民网,1,1581121219000,22,吉林省,1581120448000,20-02-08 08:07,http://m.weibo.cn/2286908003/4469605475029507,"2月7日0-24时，吉林省新增确诊病例4例，由疑似病例转为确诊病例1例，在密切接触者中主动开展核酸检测筛查出3例。截至2月7日24时，吉林省累计报告确诊病例69例，累计治愈出院4例，死亡1例，现在院隔离治疗确诊病例64例。2月7日0-24时，全省原有71例疑似病例中，转为确诊病例1例，排除疑似病例16例；新增疑似病例13例；现有疑似病例67例，目前正在进一步明确诊断。
",吉林新增4例，累计69例
1,1581121219000,,0,1581121219000,1,2781,央视新闻,1,1581121219000,13,河北省,1581120224000,20-02-08 08:03,http://m.weibo.cn/2656274875/4469604535935240,2020年2月7日0—24时，河北省报告新型冠状病毒感染的肺炎新增确诊病例24例。新增治愈出院病例9例。新增疑似病例36例。 截至2月7日24时，河北省累计报告确诊病例195例，其中死亡1例，现有重症病例16例，累计治愈出院25例。 目前累计追踪到密切接触者6720人，当日解除隔离医学观察657人，现有3423人正在接受隔离医学观察。,河北新增24例，累计确诊195例
